7IM AAP Adventurous C Acc,GB00B2PB2C75
7IM AAP Adventurous C Inc,GB00B2PB2B68
7IM AAP Balanced C Acc,GB00B2PB3794
7IM AAP Balanced C Inc,GB00B2PB2V64
7IM AAP Income C Acc,GB0033954024
7IM AAP Income C Inc,GB0033953943
7IM AAP Moderately Adventurous C Acc,GB00B2PB2M73
7IM AAP Moderately Adventurous C Inc,GB00B2PB2K59
7IM AAP Moderately Cautious C Acc,GB00B2PB2168
7IM AAP Moderately Cautious C Inc,GB00B2PB2051
7IM Adventurous C Acc,GB0033958009
7IM Adventurous C Inc,GB0033957704
7IM Balanced C Acc,GB0033959742
7IM Balanced C Inc,GB0033959296
7IM Cautious C Acc,GB00BVYPGT82
7IM Cautious C Inc,GB00BVYPGS75
7IM Moderately Adventurous C Acc,GB0033956516
7IM Moderately Adventurous C Inc,GB0033956391
7IM Moderately Cautious C Acc,GB0033953497
7IM Moderately Cautious C Inc,GB0033953273
7IM Real Return C Acc,GB00B75MS619
7IM Sustainable Balance C Acc,GB00B1LBFZ86
7IM Sustainable Balance C Inc,GB00B1LBG003
AS SICAV I Asn Smllr Coms X Acc GBP,LU0837967669
AS SICAV I EM Infras Eq X Acc GBP,LU0925744665
AS SICAV I Glbl Mid-Cap Eq X Acc GBP,LU2178690991
AS SICAV I Glbl Mid-Cap Eq X Acc H GBP,LU2153592634
AS SICAV I Indian Equity X Acc GBP,LU0837977031
AS SICAV I SelEuro HYBd X MInc GBP,LU0837981900
Aberdeen UK Property Feeder UT I Acc,GB00BTLX1P22
Aberdeen UK Property Feeder UT I Inc,GB00BTLX1Q39
Aberdeen UK Property Feeder UT M Acc,GB00BGRLZY68
Aberdeen UK Property Feeder UT M Inc,GB00BGRLZZ75
Aberdeen UK Property I Acc,GB00BTLX1F24
Aberdeen UK Property I Inc,GB00BTLX1G31
Aberdeen UK Property M Acc,GB00BGRLS691
Aberdeen UK Property M Inc,GB00BGRLZX51
Aegon Absolute Return Bond GBP C Acc,IE00B6SLQ646
Aegon Diversified Growth GBP B Acc,GB00B625LX43
Aegon Diversified Monthly Inc GBP B Acc,GB00BJFLQY60
Aegon Diversified Monthly Inc GBP B Inc,GB00BJFLR106
Aegon Ethical Cautious Managed GBP B Acc,GB00B7V2CD05
Aegon Ethical Cautious Managed GBP B Inc,GB00B7TCPG66
Aegon Ethical Corporate Bond GBP B Acc,GB00B018K352
Aegon Ethical Corporate Bond GBP B Inc,GB00B0C4RP31
Aegon Ethical Equity GBP B Acc,GB0007450884
Aegon Ethical Equity GBP B Inc,GB00B8FZHY88
Aegon Global Equity GBP B Acc,GB0007274516
Aegon Global Equity Income GBP B Acc,IE00BF5SVX39
Aegon Global Equity Income GBP C Inc,IE00BF5SW304
Aegon Global Eq Mkts Netrl GBP C Acc,IE00BYZJ2252
Aegon Global Sustainable Eq GBP B Acc,IE00BYZJ3441
Aegon High Yield Bond GBP B Acc,GB0031425563
Aegon High Yield Bond GBP B Inc,GB00B1N9DY51
Aegon Investment Grade Bond GBP B Acc,GB00B141C763
Aegon Investment Grade Bond GBP B Inc,GB00B142F707
Aegon Investment Grd Glbl Bd B Acc GBP H,IE00B296XP88
Aegon Sterling Corporate Bond GBP B Acc,GB0007451635
Aegon Sterling Corporate Bond GBP B Inc,GB0031599870
Aegon Strategic Bond GBP B Acc,GB00B3ZLQW29
Aegon Strategic Bond GBP B Inc,GB00B00MY367
Aegon UK Equity Absolute Ret GBP B Acc,GB00B4XS8040
Aegon UK Equity GBP B Acc,GB0007451411
Aegon UK Equity GBP B Inc,GB0030522683
Aegon UK Equity Income GBP B Acc,GB00B4ZMVX86
Aegon UK Equity Income GBP B Inc,GB00B4ZMYG27
Aegon UK Opportunities GBP B Acc,GB00B1N9DS91
Aegon UK Smaller Companies GBP B Acc,GB00B142FS18
Allianz Best Styles Global AC Eq C Acc,GB00BYQ91X80
Allianz Continental European C Acc,GB00B3Q8YX99
Allianz Emerging Markets Equity C Acc,GB00B0WDH832
Allianz European Equity Income C Acc,GB00B613Y740
Allianz European Equity Income C Inc,GB00B613Y633
Allianz Gilt Yield I Inc,GB0031383390
Allianz RiskMaster Cnsrv Mlt Asst C Acc,GB00B7V78Q03
Allianz RiskMaster Growth Mlt Asst C Acc,GB00B7V79R84
Allianz RiskMaster Mod Mlt Asst C Acc,GB00B7V78Y86
Allianz Strategic Bond C Inc,GB00B06T9362
Allianz Total Return Asian Equity C Acc,GB00BVYJ2G95
Allianz Total Return Asian Equity C Inc,GB00B1FRQV53
Allianz UK Opportunities C Acc GBP,GB00B8BB9445
Allianz UK Equity Income C Inc,GB00B82ZGC20
Allianz UK Mid Cap C Acc,GB00B83YTF22
Allianz US Equity C Acc,GB00B4N1GS74
Amundi Fds Pinr US EqFdm Gr R2 GBP C,LU1883856566
Amundi Fds Polen Cptl Glbl Gr R3 GBP C,LU2208987334
Amundi Fds Polen Cptl Glbl Gr R3 GBP AD,LU2208988142
ARC TIME Social Long Inc Fdr Tr I NetAcc,GB00BJK12P40
ARC TIME Social Long Inc Fdr Tr J NetInc,GB00BJK12Q56
ARC TIME Social Long Income A Gross Acc,GB00BJK12987
ARC TIME Social Long Income C Gross Inc,GB00BJK12C11
ARC TIME UK Infrastructure Income Acc,GB00BZ17GL78
ARC TIME UK Infrastructure Income Inc,GB00BZ17GM85
Ardevora Global Equity C GBP Acc,IE00B4XSRG30
Artemis Capital I Acc,GB00B2PLJM64
Artemis Corporate Bond I Acc GBP,GB00BFZ91W59
Artemis Corporate Bond I Inc GBP,GB00BKPWGV34
Artemis European Growth I Acc,GB00B2PLJD73
Artemis European Opportunities I Acc,GB00B6WFCR53
Artemis European Opportunities I Hdg Acc,GB00B6WFCS60
Artemis European Opportunities I Hdg Inc,GB00B6WFCV99
Artemis European Opportunities I Inc,GB00B6WFCT77
Artemis Global Emerging Mkts I Acc GBP,GB00BW9HL132
Artemis Global Emerging Mkts I Inc GBP,GB00BW9HL249
Artemis Global Growth I Acc,GB00B2PLJP95
Artemis Global Income I Acc,GB00B5ZX1M70
Artemis Global Income I Inc,GB00B5N99561
Artemis Global Select I Acc,GB00B568S201
Artemis High Income I Acc,GB00BJMD6R83
Artemis High Income I Inc,GB00B2PLJN71
Artemis High Income I Monthly Inc,GB00BJT0KR04
Artemis Income I Acc,GB00B2PLJH12
Artemis Income I Inc,GB00B2PLJJ36
Artemis Monthly Distribution I Acc,GB00B75F9Z67
Artemis Monthly Distribution I Inc,GB00B6TK3R06
Artemis Strategic Assets I Acc,GB00B3VDD431
Artemis Strategic Bond I Monthly Acc,GB00BJT0KV40
Artemis Strategic Bond I Monthly Inc,GB00B2PLJS27
Artemis Strategic Bond I Quarterly Acc,GB00B2PLJR10
Artemis Strategic Bond I Quarterly Inc,GB00BJT0KT28
Artemis UK Select I Acc,GB00B2PLJG05
Artemis UK Smaller Companies I Acc,GB00B2PLJL57
Artemis UK Smaller Companies I Inc GBP,GB00BD3GTG43
Artemis UK Special Situations I Acc,GB00B2PLJQ03
Artemis US Absolute Return I Hdg Acc GBP,GB00BMMV5N27
Artemis US Extended Alpha I Acc GBP,GB00BMMV5G59
Artemis US Extended Alpha I Hdg Acc GBP,GB00BYSZ0151
Artemis US Select I Acc GBP,GB00BMMV5105
Artemis US Select I Hedged Acc GBP,GB00BYSYZX95
Artemis US Select I Inc GBP,GB00BWWZ2D39
Artemis US Smaller Companies I Acc GBP,GB00BMMV5766
ASI (AAM) Sterling Govt Bond I Acc,GB00BWK26S93
ASI (AAM) Sterling Govt Bond I Inc,GB00BWK26T01
ASI (AAM) Sterling Short Dtd Corp I Acc,GB00BDGNF645
ASI (AAM) Sterling Short Dtd Corp I Inc,GB00BDGNF538
ASI (AAM) UK Smaller Companies I Acc,GB00B07T4859
ASI (SLI) Asian Pacific Grth Eq P1 Acc,GB00B7MZSJ60
ASI (SLI) Asian Pacific Grth Eq R Inc,GB00BYQNBJ62
ASI (SLI) Corporate Bond P1 Acc,GB00BYYR0Y84
ASI (SLI) Corporate Bond P1 Inc,GB00BYYR0Z91
ASI (SLI) Strategic Bond P1 Acc,GB00B7MWXH01
ASI (SLI) Strategic Bond P1 Inc,GB00B6W21135
ASI AAA Bond P1 Acc,GB00B3W48X95
ASI AAA Bond P1 Inc,GB00B4LQY248
ASI American Equity Enh Index B Acc,GB00BRJL8192
ASI American Equity I Acc,GB00B0XWN259
ASI American Income Eq P1 Acc,GB00BYV20911
ASI American Income Eq P1 Inc,GB00BYV20B36
ASI American Unconstrained Equity P1 Acc,GB00B7JCD629
ASI American Unconstrained Equity R Inc,GB00BYQNBC93
ASI Asia Pacific and Japan Eq I Acc,GB00B0XWNK36
ASI Asia Pacific Equity Enh Index B Acc,GB00BRJL7V21
ASI Asia Pacific Equity I Acc,GB00B0XWNG99
ASI Asia Pacific Equity I Inc,GB00B88N7058
ASI China A Share Equity M,GB00BJR5NP69
ASI Corporate Bond I Acc,GB00BWK26G71
ASI Corporate Bond I Inc,GB00BWK26H88
ASI Diversified Growth I Acc,GB00B5MNDD51
ASI Diversified Growth I Inc,GB00B6VCMV18
ASI Diversified Income I Acc,GB00B1C42779
ASI Diversified Income I Inc,GB00B1C42886
ASI Diversified Core Growth I Acc,GB00BVTW3820
ASI Dynamic Distribution P1 Acc,GB00B7CMQ047
ASI Dynamic Distribution P1 Inc,GB00B7JNXM18
ASI Dynamic MA Gr P1 Acc,GB00BFNWYG14
ASI Eastern European Equity I Acc,GB00B3NC3D74
ASI Emerging Markets Bond I Acc,GB00B5L9HN22
ASI Emerging Markets Bond I Inc,GB00B5V8SG93
ASI Emerging Markets Eq Enh Index B Acc,GB0033309757
ASI Emerging Markets Equity I Acc,GB0033227561
ASI Emerging Markets Income Eq P1 Acc,GB00B8B02G41
ASI Emerging Markets Income Eq P1 Inc,GB00B8N1FM23
ASI Ethical Corporate Bond P1 Acc,GB00B708KW45
ASI Ethical Corporate Bond P1 Inc,GB00B4LQ8T99
ASI Europe ex UK Equity I Acc,GB00B0LG6P37
ASI Europe ex UK Ethical Equity P1 Acc,GB00B3N24788
ASI Europe ex UK Growth Equity P1 Acc,GB00B72RVY84
ASI Europe ex UK Growth Equity R Inc,GB00BYQNB524
ASI Europe ex UK Income Equity P1 Acc,GB00B7LG0W70
ASI Europe ex UK Income Equity P1 Inc,GB00B71L0M27
ASI Europe ex UK Smaller Comp P1 Acc,GB00BYMMJ932
ASI European Equity Enhanced Index B Acc,GB00BRJL7X45
ASI European High Yield Bond I Acc,GB00B5VSSV49
ASI European High Yield Bond I Inc,GB00B5MFPK25
ASI European Real Estate Share I Acc,GB00BWK26907
ASI European Real Estate Share I Inc,GB00BWK26899
ASI European Smaller Companies I Acc,GB00B0XWN580
ASI Financial Equity I Inc,GB00BWK25Q05
ASI Global Absolute Ret Strat P1 Acc,GB00B7K3T226
ASI Global Balanced Growth P1 Acc,GB00B5VBS792
ASI Global Balanced Growth P1 Inc,GB00B7CQ5768
ASI Global Equity I Acc,GB0031682734
ASI Global Equity I Inc,GB00B83WC467
ASI Global Ethical Equity I Acc,GB0006833932
ASI Global Ethical Equity I Inc,GB0006833825
ASI Global Govt Bond Tracker B GBP Acc,GB00BK80KQ76
ASI Global Income Equity P1 Acc,GB00B7FVHF03
ASI Global Income Equity P1 Inc,GB00B76FLF97
ASI Global Inflation-Link Bd P1 Acc,GB00B7C0H946
ASI Global Inflation-Link Bd P1 Inc,GB00B4PPHB71
ASI Global Opprtunistic Bd I Acc,GB00B98WWS27
ASI Global Opprtunistic Bd I Inc,GB00B9JNFP23
ASI Global Real Estate P1 Acc,GB00B774LD38
ASI Global Real Estate P1 Inc,GB00B700D764
ASI Global Real Estate Share P1 Acc,GB00B7MR5W47
ASI Global Real Estate Share P1 Inc,GB00B6TQN017
ASI Global Smaller Companies P1 Acc,GB00B7KVX245
ASI Global Uncons Eq P1 Acc,GB00B6915J97
ASI Global Uncons Eq R Inc,GB00BYQNBQ30
ASI High Yield Bond P1 Acc,GB00B79RR984
ASI High Yield Bond P1 Inc,GB00B7G7DD75
ASI Investment Grade Corp Bnd P1 Acc,GB00B6TRYW36
ASI Investment Grade Corp Bnd P1 Inc,GB00B76CD438
ASI Japan Equity Enhanced Index B Acc,GB00BRJL8317
ASI Japanese Equity I Acc,GB0004521737
ASI Japanese Growth Equity P1 Acc,GB00B76C7M93
ASI Latin American Equity I Acc,GB00B4R0SD95
ASI Multi-Asset I Acc,GB0031682395
ASI Multi-Asset I Inc,GB00B1GCQ869
ASI Multi-Manager Balanced Managed I Acc,GB00B843VR45
ASI Multi-Manager Balanced Managed I Inc,GB00B83W7300
ASI Multi-Manager Cautious Managed I Acc,GB00B8GLGR18
ASI Multi-Manager Cautious Managed I Inc,GB00B6Z4Y178
ASI Multi-Manager Diversity D Acc,GB00B7DZK008
ASI Multi-Manager Equity Managed I Acc,GB00B7GQCS25
ASI Multi-Manager Equity Managed I Inc,GB00B83VDH39
ASI Multi-Manager Ethical I Acc,GB00B87TVT17
ASI Multi-Manager Ethical I Inc,GB00B8868L21
ASI Multi-Manager Multi-Asset Dist I Acc,GB00B8340374
ASI Multi-Manager Multi-Asset Dist I Inc,GB00B8HP4451
ASI MyFolio Index I Plat Fixed Acc,GB00BHZCQL23
ASI MyFolio Index II Plat Fixed Acc,GB00BHZCQQ77
ASI MyFolio Index III Plat Fixed Acc,GB00BHZCQV21
ASI MyFolio Index IV Plat Fixed Acc,GB00BHZCQZ68
ASI MyFolio Index V Plat Fixed Acc,GB00BHZCR313
ASI MyFolio Managed I P1 Acc,GB00B62FNJ48
ASI MyFolio Managed I P1 Inc,GB00BHZCR750
ASI MyFolio Managed II P1 Acc,GB00B3RHFQ59
ASI MyFolio Managed II P1 Inc,GB00BHZCRD14
ASI MyFolio Managed III P1 Acc,GB00B701F734
ASI MyFolio Managed III P1 Inc,GB00BHZCRJ75
ASI MyFolio Managed IV P1 Acc,GB00B759VC93
ASI MyFolio Managed IV P1 Inc,GB00BHZCRN12
ASI MyFolio Managed V P1 Acc,GB00B7LL4310
ASI MyFolio Managed V P1 Inc,GB00BHZCRS66
ASI MyFolio Market I P1 Acc,GB00B7KSN259
ASI MyFolio Market II P1 Acc,GB00B41R9999
ASI MyFolio Market III P1 Acc,GB00B758J660
ASI MyFolio Market IV P1 Acc,GB00B77CW014
ASI MyFolio Market V P1 Acc,GB00B3T5XZ20
ASI MyFolio Monthly Inc II P1 Acc,GB00B74TWC77
ASI MyFolio Monthly Inc II P1 Inc,GB00B6S7NM79
ASI MyFolio Monthly Inc III P1 Acc,GB00B7680C87
ASI MyFolio Monthly Inc III P1 Inc,GB00B4L19681
ASI MyFolio Monthly Inc IV P1 Acc,GB00B4X43N09
ASI MyFolio Monthly Inc IV P1 Inc,GB00B7F2PP90
ASI MyFolio Mlt-Mgr I P1 Acc,GB00B7FMDY47
ASI MyFolio Mlt-Mgr I P1 Income,GB00BHZCRX10
ASI MyFolio Multi-Manager II P1 Acc,GB00B7FH4R99
ASI MyFolio Multi-Manager III P1 Acc,GB00B7G6TF84
ASI MyFolio Multi-Manager IV P1 Acc,GB00B6XW0B53
ASI MyFolio Multi-Manager V P1 Acc,GB00B7MMLL01
ASI MyFolio Multi-Manager V P1 Income,GB00BHZCS162
ASI Short Duration Credit P1 Acc,GB00B7F7XT42
ASI Short Duration Credit P1 Income,GB00B63SCK67
ASI Short Dur Gbl Infl Lnk P1 Acc,GB00BP25RB79
ASI Short Dur Gbl Infl Lnk P1 Inc,GB00BP25RC86
ASI Sterling Bond I Acc,GB00BWK27087
ASI Sterling Bond I Inc,GB00BWK27194
ASI Sterling Inflation-Linked Bond I Acc,GB00BWK27533
ASI Sterling Inflation-Linked Bond I Inc,GB00BWK27640
ASI Sterling Money Market I Acc,GB00B1C42332
ASI Sterling Money Market I Inc,GB00B1C42449
ASI Sterling Short Term Govt Bond I Acc,GB00BWK25K43
ASI Sterling Short Term Govt Bond I Inc,GB00BWK25L59
ASI Strategic Bond I Acc,GB00BWK27Z36
ASI Strategic Bond I Inc,GB00BWK28051
ASI Target Return Bond I Acc,GB00BWK27C09
ASI Target Return Bond I Inc,GB00BWK27D16
ASI UK Equity Enhanced Index B Acc,GB00BRJL8531
ASI UK Equity I Acc,GB00B0LG6K81
ASI UK Equity I Inc,GB00B0LG6J76
ASI UK Ethical Equity P1 Acc,GB00B6Y80X40
ASI UK Ethical Equity P1 Income,GB00BVFNS394
ASI UK Government Bond P1 Acc,GB00B6WZXS38
ASI UK Government Bond P1 Income,GB00B5MP5686
ASI UK Growth Equity P1 Acc,GB00B7J4W502
ASI UK High Alpha Equity P1 Acc,GB00B76G2B50
ASI UK High Alpha Equity P1 Inc,GB00B7D6MV88
ASI UK High Income Equity P1 Acc,GB00B7FTRJ84
ASI UK High Income Equity P1 Inc,GB00B558NM60
ASI UK Impact Employ Opprt Eq P1 Acc,GB00BZC0J613
ASI UK Income Equity I Acc,GB00B0XWN929
ASI UK Income Equity I Inc,GB00B0XWNB45
ASI UK Income Unconstrained Eq P1 Acc,GB00B79X9673
ASI UK Income Unconstrained Eq P1 Inc,GB00B7G8Q193
ASI UK Mid-Cap Equity I Acc,GB00B0XWNT29
ASI UK Mid-Cap Equity I Inc,GB00B0XWNS12
ASI UK Opportunities Equity P1 Acc,GB00B7LZCR36
ASI UK Opportunities Equity P1 Inc,GB00B7C4BJ40
ASI UK Real Estate Share I Acc,GB00B0XWNN66
ASI UK Responsible Equity I Acc,GB00B131GD17
ASI UK Responsible Equity I Inc,GB00B131GH54
ASI UK Smaller Companies P1 Acc,GB00B7FBH943
ASI UK Smaller Companies R Inc,GB00BYQNBS53
ASI UK Unconstrained Equity P1 Acc,GB00B7LK2232
ASI World Equity Enhanced Index B Acc,GB00BRJL7Z68
ASI World Income Equity I Acc,GB00B8MYXW82
ASI World Income Equity I Inc,GB00B3NG6H45
Atlantic House Defined Returns B GBP Acc,IE00BFLR2202
Atlantic House Defined Returns I Inc GBP,IE00BF2ZW348
BlackRock Global Equity D Acc,GB00B4XLYS34
BlackRock Global Equity D Inc,GB00B8DDP952
Aviva Investors Contnn Eurp Eq 2 GBP Acc,GB0004461322
Aviva Investors Corporate Bd 2 GBP Inc,GB0004462957
Aviva Investors Distribution 2 GBP Acc,GB00BYZC2W42
Aviva Investors Distribution 2 GBP Inc,GB0030442320
Aviva Investors Global Eq Endur 2 £ Acc,GB00BYXHPJ99
Aviva Investors Global Eq Inc 2 GBP Acc,GB0030442098
Aviva Investors Global Eq Inc 2 GBP Inc,GB00B9LCNW07
Aviva Investors High Yield Bd 2 GBP Inc,GB00B3CGJJ86
Aviva Investors Higher Inc Pls 2 GBP Inc,GB0008531302
Aviva Investors Intl Idx Tr 2 £ Acc,GB00B2NRNX53
Aviva Investors Managed Hi Inc 2 GBP Inc,GB0004463039
Aviva Investors Mthly Inc Pls 2 GBP Acc,GB00B7RBPT80
Aviva Investors Mthly Inc Pls 2 GBP Inc,GB00B7RBPR66
Aviva Investors Mlt-Asst Pl I 2 GBP Acc,GB00B70FJQ29
Aviva Investors Mlt-Asst Pl II 2 GBP Acc,GB00B7JRQQ84
Aviva Investors Mlt-Asst Pl III 2 GBPAcc,GB00B581Z480
Aviva Investors Mlt-Asst Pl IV 2 GBP Acc,GB00B72W9168
Aviva Investors Mlt-Asst Pl V 2 GBP Acc,GB00B7FM5934
Aviva Investors Multi-Mgr 20-60% 2 £Acc,GB00B1N94W01
Aviva Investors Multi-Mgr 20-60% 2 £Inc,GB00B7ZZR410
Aviva Investors Multi-Mgr 40-85% 2 £Acc,GB00B1N94Q41
Aviva Investors Multi-Mgr 40-85% 2 £Inc,GB00B8FV3N77
Aviva Investors Multi-Mgr Flexible 2£Acc,GB00B1N95279
Aviva Investors Mlt-Strat Trgt Inc 2£Inc,GB00BQSBPF62
Aviva Investors Mlt-Strat Trgt Ret 2£Acc,GB00BMJ6DT26
Aviva Investors Strategic Bd 2 GBP Inc,GB00B3CGHN82
Aviva Investors UK Index Tracking 2 £Inc,GB00B8XCGM21
Aviva Investors UK Lstd Eq Hi Alp2GBPAcc,GB0030944648
Aviva Investors UK Listed Eq Inc 2 £ Acc,GB00B6R51K64
Aviva Investors UK Listed Eq Inc 2 £ Inc,GB0004460803
Aviva Investors UK Lstd Eq Uncons2GBPAcc,GB0004460357
Aviva Investors UK Lstd Eq Uncons2GBPInc,GB00B7RBQX91
Aviva Investors UK Lstd S&M Cap2 GBP Acc,GB0004460571
Aviva Investors UK Smaller Coms 2 £ Acc,GB0004462171
Aviva Investors US Equity Inc II 2 £ Acc,GB00BCGD4Q00
Aviva Investors US Equity Inc II 2 £ Inc,GB00BCGD4P92
AXA Defensive Distribution Z Acc Gross,GB00B03KM006
AXA Defensive Distribution Z Inc Gross,GB00B03KM113
AXA Distribution Z Acc,GB0006160104
AXA Distribution Z Inc,GB0006160542
AXA Ethical Distribution Z Acc,GB0005409262
AXA Ethical Distribution Z Inc,GB00B3FKKK57
AXA Framlington American Growth Z Acc,GB00B5LXGG05
AXA Framlington American Growth Z Inc,GB00B4152K59
AXA Framlington Biotech GBP Z Acc,GB00B784NS11
AXA Framlington Biotech Z Inc,GB00BRJZVL27
AXA Framlington Emerging Mkts Z GBP Acc,GB00B4490M25
AXA Framlington Emerging Mkts Z GBP Inc,GB00B403RF05
AXA Framlington European Z Inc,GB00BRJZVM34
AXA Framlington European Z GBP Acc,GB00B7G8XW93
AXA Framlington FinTech Z GBP Acc,GB00B5BHKC62
AXA Framlington FinTech Z Inc,GB00BRJZVN41
AXA Framlington Global Technology Z Acc,GB00B4W52V57
AXA Framlington Global Technology Z Inc,GB00B5MQXC30
AXA Framlington Global Thematics Z Acc,GB00B7MMKJ14
AXA Framlington Global Thematics Z Inc,GB00BRJZVP64
AXA Framlington Health Z GBP Acc,GB00B6WZJX05
AXA Framlington Health Z Inc,GB00BRJZVQ71
AXA Framlington Japan Z GBP Acc,GB00B7FSWP64
AXA Framlington Japan Z Inc,GB00BRJZVR88
AXA Framlington Managed Balanced Z Acc,GB00B7MMHK16
AXA Framlington Managed Balanced Z Inc,GB00B7MQY793
AXA Framlington Managed Income Z Grs Acc,GB00B7H1PG56
AXA Framlington Managed Income Z Grs Inc,GB00B71DB365
AXA Framlington Monthly Income Z GBP Acc,GB00B7MMK809
AXA Framlington Monthly Income Z GBP Inc,GB00B7MMK577
AXA Framlington UK Equity Income Z £ Acc,GB00B7KBNV36
AXA Framlington UK Equity Income Z £ Inc,GB00B8HHY295
AXA Framlington UK Growth Z GBP Acc,GB00B51R1233
AXA Framlington UK Growth Z GBP Inc,GB00B55S4R83
AXA Framlington UK Mid Cap Z GBP Acc,GB00B64W4Q70
AXA Framlington UK Mid Cap Z GBP Inc,GB00B3SYV567
AXA Framlington UK Select Opps ZI Acc,GB00B7FD4C20
AXA Framlington UK Select Opps ZI Inc,GB00B703ZS07
AXA Framlington UK Smlr Coms Z GBP Acc,GB00B7MMLM18
AXA Framlington UK Smlr Coms Z GBP Inc,GB00BRJZVS95
AXA Global Distribution Z Acc,GB0008309063
AXA Global Distribution Z Inc,GB0008308982
AXA Global High Income Z Gross Acc,GB00B29NGF01
AXA Global High Income Z Gross Inc,GB00B29NG940
AXA Global Short Duration Bond Z GBP Acc,GB00BDFZQV30
AXA Global Short Duration Bond Z GBP Inc,GB00BDFZQW47
AXA Pan European High Yld Bond Z Grs Acc,GB00B6XDWS91
AXA Pan European High Yld Bond Z Grs Inc,GB00B6XCXM71
AXA Rosenberg American Z,GB0007460149
AXA Rosenberg Asia Pacific ex Japan Z,GB0007704330
AXA Rosenberg Global Z,GB0007717159
AXA Rosenberg Japan Z,GB0007371593
AXA Sterling Buy & Mntn Crdt Z GBP Acc,GB00B7VXY261
AXA Sterling Corporate Bond Z Gross Acc,GB00B1Z48Z43
AXA Sterling Corporate Bond Z Gross Inc,GB00B1Z48X29
AXA Sterling Crdt Shrt Dura Bd Z Grs Acc,GB00B5L2N222
AXA Sterling Crdt Shrt Dura Bd Z Grs Inc,GB00B5VL0B78
AXA Sterling Index Linked Bond Z Gross,GB00B02Y6B22
AXA Sterling Strategic Bond Z (G) Acc,GB00B02Y6L20
AXA US Short Duration Hi Yld Z Gross Acc,GB00B59VLT43
AXA US Short Duration Hi Yld Z Gross Inc,GB00B5TX5Q59
Baillie Gifford American B Acc,GB0006061963
Baillie Gifford American B Inc,GB0006061856
Baillie Gifford British Smlr Coms B Acc,GB0005931356
Baillie Gifford British Smlr Coms B Inc,GB0005930382
Baillie Gifford China B Acc,GB00B39RMM81
Baillie Gifford China B Inc,GB00B3K73F73
Baillie Gifford Developed Asia Pac B Acc,GB0030492044
Baillie Gifford Developed Asia Pac B Inc,GB0030491632
Baillie Gifford Emerging Mkts Bd B Inc,GB00B39RMQ20
Baillie Gifford Emerging Mkts Gr B Acc,GB0006020647
Baillie Gifford Emerging Mkts Gr B Inc,GB0006020530
Baillie Gifford Em Mkts Lead Coms B Acc,GB00B06HZN29
Baillie Gifford Em Mkts Lead Coms B Inc,GB00B06HZP43
Baillie Gifford European B Acc,GB0006058258
Baillie Gifford European B Inc,GB0006057391
Baillie Gifford Global Alpha Gr B Acc,GB00B61DJ021
Baillie Gifford Global Alpha Gr B Inc,GB00B3PPZ729
Baillie Gifford Global Discovery B Acc,GB0006059330
Baillie Gifford Global Discovery B Inc,GB0006059223
Baillie Gifford Global Inc Growth B Acc,GB0005772479
Baillie Gifford Global Inc Growth B Inc,GB0005772586
Baillie Gifford High Yield Bond B Acc,GB00B1W0GF10
Baillie Gifford High Yield Bond B Inc,GB0030816713
Baillie Gifford International B Acc,GB0005941272
Baillie Gifford International B Inc,GB0005940316
Baillie Gifford Global Stewardship B Acc,GB00BYNK7G95
Baillie Gifford Multi Asset Income B Acc,GB00BFXY2964
Baillie Gifford Multi Asset Income B Inc,GB00BFXY2857
Baillie Gifford Investment Grd Bd B Inc,GB0030816481
Baillie Gifford Invm Grd Lng Bd B Inc,GB0032501818
Baillie Gifford Japanese B Acc,GB0006011133
Baillie Gifford Japanese B Inc,GB0006010945
Baillie Gifford Japanese Inc Gr B £ Acc,GB00BYZJQH88
Baillie Gifford Japanese Inc Gr B £ Inc,GB00BYZJQG71
Baillie Gifford Japan Small Co B Acc,GB0006014921
Baillie Gifford Japan Small Co B Inc,GB0006014582
Baillie Gifford L/T Glb Gr Invm B Acc,GB00BD5Z0Z54
Baillie Gifford Managed B Acc,GB0006010168
Baillie Gifford Managed B Inc,GB0006007909
Baillie Gifford Pacific B Acc,GB0006063233
Baillie Gifford Pacific B Inc,GB0006063340
Baillie Gifford Positive Change B Acc,GB00BYVGKV59
Baillie Gifford Positive Change B Inc,GB00BYVGKX73
Baillie Gifford Rspnb Glb Eq Inc B Acc,GB00BFM4CT76
Baillie Gifford Rspnb Glb Eq Inc B Inc,GB00BFM4N494
Baillie Gifford Strategic Bond B Acc,GB0005947857
Baillie Gifford Strategic Bond B Inc,GB0005947741
Baillie Gifford UK and Worldwide Eq B,GB00BZ3G2B42
Baillie Gifford UK and Worldwide Eq BInc,GB00BZ3G2C58
Baillie Gifford UK Equity Alpha B Acc,GB0005858195
Baillie Gifford UK Equity Alpha B Inc,GB0005857908
Barclays Europe (ex-UK) Alpha R Acc GBP,GB00B72WQ825
Barclays Europe (ex-UK) Alpha R Dis GBP,GB00B4SZX493
Barclays Global Core R Acc GBP,GB00B51B9325
Barclays Global Core R Dis GBP,GB00B4WZMX77
Barclays Multi-Asset Balanced R Acc GBP,GB00BD93ZP09
Barclays Multi-Asset Balanced R Inc GBP,GB00BD93ZN84
Barclays Multi-Asset Bal Inc R Dis GBP,GB00B68F5S16
Barclays Multi-Asset Cautious R Acc GBP,GB00BD93ZC79
Barclays Multi-Asset Cau Inc R Acc GBP,GB00B6WYG696
Barclays Multi-Asset Cau Inc R Dis GBP,GB00B3TJ5697
Barclays Multi-Asset Defensive R Acc GBP,GB00BD93Z160
Barclays Multi-Asset Defensive R Inc GBP,GB00BD93Z053
Barclays Multi-Asset Growth R Acc GBP,GB00BD940032
Barclays Sterling Bond R Acc GBP,GB00B72Y6K08
Barclays Sterling Bond R Dis GBP,GB00B4NG6L54
Barclays Sterling Corporate Bd R Acc GBP,GB00B4TJCV01
Barclays Sterling Corporate Bd R Dis GBP,GB00B6SPRV88
Barclays UK Alpha S2 R Acc GBP,GB00B3PLKF36
Barclays UK Alpha S2 R Dis GBP,GB00B4NJ9Z91
Barclays UK Alpha R Acc GBP,GB00B6TRT400
Barclays UK Alpha R Dis GBP,GB00B51BVV49
Barclays UK Core R Acc GBP,GB00B6RXX826
Barclays UK Core R Dis GBP,GB00B6VZ4693
Barclays UK Equity Income S2 R Acc GBP,GB00B6VB3719
Barclays UK Equity Income S2 R Dis GBP,GB00B4RNTN57
Barclays UK Equity Income R Acc GBP,GB00B44VWM29
Barclays UK Equity Income R Dis GBP,GB00B3YM4B14
Barclays UK Lower Cap R Acc GBP,GB00B6QSZX77
Barclays UK Lower Cap R Dis GBP,GB00B6ZSXK16
Barclays UK Opportunities R Acc GBP,GB00B52G0229
Barclays UK Opportunities R Dis GBP,GB00B4M0HV55
Barclays Wealth Global Mkts 1 R Acc GBP,GB00B55LZH47
Barclays Wealth Global Mkts 1 R Dis GBP,GB00B5346P09
Barclays Wealth Global Mkts 2 R Acc GBP,GB00B510V991
Barclays Wealth Global Mkts 2 R Dis GBP,GB00B51RWR53
Barclays Wealth Global Mkts 3 R Acc GBP,GB00B4Z0MR31
Barclays Wealth Global Mkts 3 R Dis GBP,GB00B5676788
Barclays Wealth Global Mkts 4 R Acc GBP,GB00B4ZFH287
Barclays Wealth Global Mkts 5 R Acc GBP,GB00B4YPY060
